{
  "$schema": "http://json-schema.org/draft-07/schema#",
  "title": "fleetest アプリケーションプロファイル",
  "description": "アプリケーションプロファイル(profiles/apps/<name>.json)。最上位キーは platform / autoInstall / healthCheckURL / ios / android。構造の正は Sources/FTCore/RunProfile.swift の AppProfile / AppProfileSection / ProfileResolver.validate。",
  "type": "object",
  "additionalProperties": true,
  "properties": {
    "platform": {
      "type": "string",
      "enum": [
        "ios",
        "android",
        "hybrid"
      ],
      "description": "アプリの対象 OS。省略は hybrid(iOS・Android 両方)。対象外 OS のデバイスは実行時に無視される(1台ごとに警告。実行プロファイルの JSON は変わらない)。"
    },
    "autoInstall": {
      "type": "boolean",
      "description": "実行前に appPath を自動インストールするか。**未指定の既定は appPath の有無**(パスがあれば有効・中身が変わったときだけ入れ直す)。止めたいときだけ false を明示する。"
    },
    "healthCheckURL": {
      "type": "string",
      "description": "アプリが依存するバックエンドの死活確認 URL。実行前に到達確認し不達なら警告(ブロックはしない)"
    },
    "ios": {
      "$ref": "#/definitions/platformSection",
      "description": "iOS 用のセクション。"
    },
    "android": {
      "$ref": "#/definitions/platformSection",
      "description": "Android 用のセクション。"
    }
  },
  "definitions": {
    "platformSection": {
      "type": "object",
      "description": "アプリケーションプロファイルの ios/android セクション(AppProfileSection)。autoInstall / healthCheckURL は最上位キー。",
      "additionalProperties": true,
      "properties": {
        "appName": {
          "type": "string",
          "description": "ユーザーがアプリを識別するための表示名(レポート/GUI/ログで使用)。"
        },
        "app": {
          "type": "string",
          "description": "bundle identifier(iOS) / パッケージ名(Android)。実行プロファイルの解決に必須(デバイスのある OS のセクションに定義する)。"
        },
        "appPath": {
          "type": "string",
          "description": "パッケージファイル(.app / .apk)のパス。プロジェクトルート相対・絶対パス・~ 展開のいずれかに対応する。"
        },
        "appPathPhysical": {
          "type": "string",
          "description": "実機に配るパッケージのパス(省略時は appPath)。iOS はシミュレータ用ビルド(iphonesimulator SDK・未署名)を実機へ入れられないため、同じアプリでも成果物が2つ要る。Android は同じ APK が両方で動くので普通は書かない。"
        }
      }
    }
  }
}
