{
  "platform": "hybrid",
  "autoInstall": true,
  "healthCheckURL": "http://localhost:8090/",
  "ios": {
    "appName": "SUT Store",
    "app": "com.sutec.mobile",
    "appPath": "../sut-ec-mobile/dist/ios-simulator/SUTStore.app",
    "appPathPhysical": "../sut-ec-mobile/dist/ios-device/SUTStore.app"
  },
  "android": {
    "appName": "SUT Store",
    "app": "com.sutec.mobile",
    "appPath": "../sut-ec-mobile/dist/android/sut-store-debug.apk"
  }
}
